marks,question,subject,topic,weightage,email
1,What is the key feature of a binary search tree?,Computer Science,Data Structures,2,thehitman@gmail.com
1,Define a hash table.,Computer Science,Data Structures,2,thehitman@gmail.com
1,What is the purpose of a graph data structure?,Computer Science,Data Structures,3,thehitman@gmail.com
1,Explain the concept of a priority queue.,Computer Science,Data Structures,3,thehitman@gmail.com
1,Define a heap and its types.,Computer Science,Data Structures,3,thehitman@gmail.com
1,What is the difference between a singly linked list and a doubly linked list?,Computer Science,Data Structures,2,thehitman@gmail.com
1,Explain the time complexity of accessing an element in an array.,Computer Science,Data Structures,3,thehitman@gmail.com
1,"Define the term hashing"""" in data structures.""""",Computer Science,Data Structures,2,thehitman@gmail.com
1,What is the basic principle of a trie?,Computer Science,Data Structures,3,thehitman@gmail.com
1,Explain the concept of dynamic arrays.,Computer Science,Data Structures,2,thehitman@gmail.com
1,Define a circular linked list.,Computer Science,Data Structures,3,thehitman@gmail.com
1,What is the use of a bloom filter?,Computer Science,Data Structures,4,thehitman@gmail.com
1,"Define the term sparse matrix"""" in data structures.""""",Computer Science,Data Structures,2,thehitman@gmail.com
1,Explain the concept of a red-black tree.,Computer Science,Data Structures,4,thehitman@gmail.com
1,What is the purpose of a B-tree?,Computer Science,Data Structures,3,thehitman@gmail.com
1,Define a self-balancing tree.,Computer Science,Data Structures,4,thehitman@gmail.com
1,What is the time complexity of linear search?,Computer Science,Algorithms,2,thehitman@gmail.com
1,"Define the term greedy algorithm.""""""""",Computer Science,Algorithms,2,thehitman@gmail.com
1,Explain the process of binary search.,Computer Science,Algorithms,3,thehitman@gmail.com
1,What is the main idea behind the divide and conquer strategy?,Computer Science,Algorithms,3,thehitman@gmail.com
1,"Define the term backtracking"""" in algorithms.""""",Computer Science,Algorithms,3,thehitman@gmail.com
1,Explain the concept of the bubble sort algorithm.,Computer Science,Algorithms,2,thehitman@gmail.com
1,What is the purpose of Dijkstra's algorithm?,Computer Science,Algorithms,4,thehitman@gmail.com
1,"Define the term dynamic programming.""""""""",Computer Science,Algorithms,3,thehitman@gmail.com
1,Explain the process of the quicksort algorithm.,Computer Science,Algorithms,3,thehitman@gmail.com
1,What is the time complexity of the merge sort algorithm?,Computer Science,Algorithms,2,thehitman@gmail.com
1,"Define the term algorithmic complexity.""""""""",Computer Science,Algorithms,2,thehitman@gmail.com
1,Explain the concept of the breadth-first search (BFS) algorithm.,Computer Science,Algorithms,3,thehitman@gmail.com
1,What is the use of the Kruskal's algorithm?,Computer Science,Algorithms,4,thehitman@gmail.com
1,"Define the term time complexity.""""""""",Computer Science,Algorithms,2,thehitman@gmail.com
1,Explain the concept of the insertion sort algorithm.,Computer Science,Algorithms,2,thehitman@gmail.com
1,What is the purpose of the Floyd-Warshall algorithm?,Computer Science,Algorithms,4,thehitman@gmail.com
1,"Define the term asymptotic notation"""" (Big-O notation).""""",Computer Science,Algorithms,2,thehitman@gmail.com
1,Explain the concept of the selection sort algorithm.,Computer Science,Algorithms,2,thehitman@gmail.com
1,What is the time complexity of the heap sort algorithm?,Computer Science,Algorithms,3,thehitman@gmail.com
1,"Define the term graph traversal"""" in algorithms.""""",Computer Science,Algorithms,3,thehitman@gmail.com
1,What is a variable in programming?,Computer Science,Computer Programming,1,thehitman@gmail.com
1,"Define the term function"""" in programming.""""",Computer Science,Computer Programming,1,thehitman@gmail.com
1,Explain the purpose of conditional statements (if-else) in programming.,Computer Science,Computer Programming,2,thehitman@gmail.com
1,What is a loop in computer programming?,Computer Science,Computer Programming,1,thehitman@gmail.com
1,"Define the term data type.""""""""",Computer Science,Computer Programming,1,thehitman@gmail.com
1,Explain the concept of arrays in programming.,Computer Science,Computer Programming,1,thehitman@gmail.com
1,What is the purpose of object-oriented programming (OOP)?,Computer Science,Computer Programming,2,thehitman@gmail.com
1,"Define the term recursion"""" in programming.""""",Computer Science,Computer Programming,2,thehitman@gmail.com
1,"Explain the use of the switch"""" statement in programming.""""",Computer Science,Computer Programming,2,thehitman@gmail.com
1,What is the purpose of a constructor in object-oriented programming?,Computer Science,Computer Programming,2,thehitman@gmail.com
1,"Define the term pointer"""" in programming.""""",Computer Science,Computer Programming,2,thehitman@gmail.com
1,"Explain the concept of inheritance"""" in object-oriented programming.""""",Computer Science,Computer Programming,3,thehitman@gmail.com
1,What is the purpose of exception handling in programming?,Computer Science,Computer Programming,3,thehitman@gmail.com
1,"Define the term string"""" in programming.""""",Computer Science,Computer Programming,1,thehitman@gmail.com
1,Explain the concept of encapsulation in object-oriented programming.,Computer Science,Computer Programming,3,thehitman@gmail.com
1,"What is the purpose of the for"""" loop in programming?""""",Computer Science,Computer Programming,1,thehitman@gmail.com
1,"Define the term polymorphism"""" in object-oriented programming.""""",Computer Science,Computer Programming,3,thehitman@gmail.com
1,Explain the concept of file input/output (I/O) in programming.,Computer Science,Computer Programming,2,thehitman@gmail.com
1,"What is the purpose of the while"""" loop in programming?""""",Computer Science,Computer Programming,1,thehitman@gmail.com
1,"Define the term abstraction"""" in object-oriented programming.""""",Computer Science,Computer Programming,3,thehitman@gmail.com
2,Explain the advantages and disadvantages of using an array.,Computer Science,Data Structures,4,thehitman@gmail.com
2,Compare and contrast singly linked lists and doubly linked lists.,Computer Science,Data Structures,3,thehitman@gmail.com
2,Describe the working principle of a stack and its real-world applications.,Computer Science,Data Structures,4,thehitman@gmail.com
2,Discuss the different methods of traversing a binary tree.,Computer Science,Data Structures,4,thehitman@gmail.com
2,Explain the process of hash collision resolution in a hash table.,Computer Science,Data Structures,3,thehitman@gmail.com
2,Compare the time complexities of linear search and binary search.,Computer Science,Data Structures,4,thehitman@gmail.com
2,Implement a priority queue using a binary heap and demonstrate its usage.,Computer Science,Data Structures,4,thehitman@gmail.com
2,How can you implement a circular queue using an array?,Computer Science,Data Structures,4,thehitman@gmail.com
2,Describe the concept of a self-adjusting list and its benefits.,Computer Science,Data Structures,3,thehitman@gmail.com
2,Implement the operations of insert and delete for a binary search tree.,Computer Science,Data Structures,4,thehitman@gmail.com
2,Discuss the role of a hash function in a hash table and its requirements.,Computer Science,Data Structures,3,thehitman@gmail.com
2,Explain the process of balancing a red-black tree after a node insertion.,Computer Science,Data Structures,5,thehitman@gmail.com
2,Implement Dijkstra's algorithm to find the shortest path in a weighted graph.,Computer Science,Data Structures,4,thehitman@gmail.com
2,Describe the steps to perform the union operation in a disjoint-set data structure.,Computer Science,Data Structures,4,thehitman@gmail.com
2,Discuss the working principle of a trie and its use in string searching.,Computer Science,Data Structures,4,thehitman@gmail.com
2,Compare the time complexities of various sorting algorithms.,Computer Science,Data Structures,3,thehitman@gmail.com
2,Implement the breadth-first search (BFS) algorithm for a graph traversal.,Computer Science,Data Structures,4,thehitman@gmail.com
2,Discuss the concept of a minimum spanning tree (MST) and its applications.,Computer Science,Data Structures,4,thehitman@gmail.com
2,Implement a stack using a linked list and demonstrate its operations.,Computer Science,Data Structures,3,thehitman@gmail.com
2,Discuss the applications of bloom filters and their limitations.,Computer Science,Data Structures,5,thehitman@gmail.com
4,Discuss the implementation of a graph data structure using an adjacency matrix and an adjacency list.,Computer Science,Data Structures,5,thehitman@gmail.com
4,Implement a skip list with efficient insertion deletion and search operations.,Computer Science,Data Structures,5,thehitman@gmail.com
4,Explain the principles of the Boyer-Moore algorithm for pattern matching with multiple patterns.,Computer Science,Data Structures,5,thehitman@gmail.com
4,Discuss the design and working of a k-ary heap and its comparison with a binary heap.,Computer Science,Data Structures,5,thehitman@gmail.com
4,Implement a B-tree and analyze its time complexity for search insert and delete operations.,Computer Science,Data Structures,5,thehitman@gmail.com
4,Explain the concept of a suffix tree and its use in pattern matching and substring search.,Computer Science,Data Structures,5,thehitman@gmail.com
4,Discuss the advantages and disadvantages of using a trie over a hash table for dictionary storage.,Computer Science,Data Structures,4,thehitman@gmail.com
4,Implement a radix sort algorithm for integers and analyze its time complexity.,Computer Science,Data Structures,5,thehitman@gmail.com
4,Describe the working of a Cartesian tree and its applications in solving range queries.,Computer Science,Data Structures,4,thehitman@gmail.com
4,Discuss the principles of the Edmonds-Karp algorithm for maximum flow in a network.,Computer Science,Data Structures,5,thehitman@gmail.com
4,Discuss the concept of a dynamic programming approach for solving the longest common subsequence (LCS) problem.,Computer Science,Algorithms,5,thehitman@gmail.com
4,Implement the Boyer-Moore-Galil algorithm for string matching and analyze its efficiency.,Computer Science,Algorithms,5,thehitman@gmail.com
4,Explain the process of finding the strongly connected components (SCCs) in a directed graph.,Computer Science,Algorithms,5,thehitman@gmail.com
4,Discuss the design and working of the Knapsack problem using the 0-1 Knapsack algorithm.,Computer Science,Algorithms,5,thehitman@gmail.com
4,Implement the Ford-Fulkerson algorithm using the depth-first search (DFS) for finding maximum flow.,Computer Science,Algorithms,5,thehitman@gmail.com
4,Explain the concept of the Rabin-Karp algorithm for multiple pattern string matching with rolling hash.,Computer Science,Algorithms,5,thehitman@gmail.com
4,Discuss the working principles of a suffix array and its use in substring search and pattern matching.,Computer Science,Algorithms,5,thehitman@gmail.com
4,Implement the Floyd-Warshall algorithm for finding all-pairs shortest paths and analyze its efficiency.,Computer Science,Algorithms,5,thehitman@gmail.com
4,Describe the process of constructing a B+ tree and its applications in database systems.,Computer Science,Algorithms,5,thehitman@gmail.com
4,Discuss the principles of the Minimum Spanning Tree (MST) using Prim's algorithm with binary heaps.,Computer Science,Algorithms,5,thehitman@gmail.com
4,Discuss the principles of operator overloading in Python with multiple examples.,Computer Science,Computer Programming,5,thehitman@gmail.com
4,Implement a stack-based algorithm to convert infix expressions to postfix expressions.,Computer Science,Computer Programming,5,thehitman@gmail.com
4,Explain the process of implementing a circular queue with dynamic resizing in C++,Computer Science,Computer Programming,5,thehitman@gmail.com
4,Discuss the principles of inheritance and polymorphism in object-oriented programming.,Computer Science,Computer Programming,5,thehitman@gmail.com
4,Implement a hash table using separate chaining with efficient collision handling.,Computer Science,Computer Programming,5,thehitman@gmail.com
4,Explain the concept of virtual functions and late binding in C++.,Computer Science,Computer Programming,5,thehitman@gmail.com
4,Discuss the design and implementation of a trie-based spell checker.,Computer Science,Computer Programming,5,thehitman@gmail.com
4,Implement a function to perform matrix multiplication using the Strassen algorithm.,Computer Science,Computer Programming,5,thehitman@gmail.com
4,Describe the principles of exception propagation and handling in nested function calls.,Computer Science,Computer Programming,5,thehitman@gmail.com
4,Discuss the working of the Boyer-Moore-Horspool algorithm for substring searching.,Computer Science,Computer Programming,5,thehitman@gmail.com
5,Implement a skip graph and discuss its advantages over traditional skip lists.,Computer Science,Data Structures,5,thehitman@gmail.com
5,Explain the concept of a Fibonacci heap and its use in the Dijkstra's algorithm for graph traversal.,Computer Science,Data Structures,5,thehitman@gmail.com
5,Discuss the design and working of a quadtree and its applications in 2D spatial indexing.,Computer Science,Data Structures,5,thehitman@gmail.com
5,Implement a dynamic hash table using the Cuckoo hashing technique and analyze its efficiency.,Computer Science,Data Structures,5,thehitman@gmail.com
5,Describe the working of a suffix tree construction algorithm using Ukkonen's method.,Computer Science,Data Structures,5,thehitman@gmail.com
5,Discuss the principles of the Karger's algorithm for finding the minimum cut in an undirected graph.,Computer Science,Data Structures,5,thehitman@gmail.com
5,Implement a red-black tree and demonstrate its balancing properties during insertion and deletion.,Computer Science,Data Structures,5,thehitman@gmail.com
5,Explain the concept of persistent data structures and their applications in functional programming.,Computer Science,Data Structures,5,thehitman@gmail.com
5,Discuss the design and implementation of a van Emde Boas tree for integer data storage.,Computer Science,Data Structures,5,thehitman@gmail.com
5,Implement a priority queue using a Fibonacci heap and analyze its time complexities.,Computer Science,Data Structures,5,thehitman@gmail.com
5,Explain the principles of the A* algorithm with an admissible heuristic for pathfinding.,Computer Science,Algorithms,5,thehitman@gmail.com
5,Implement the Huffman coding algorithm for data compression and analyze its efficiency.,Computer Science,Algorithms,5,thehitman@gmail.com
5,Discuss the working of the Boyer-Moore-Good-Suffix algorithm for string searching.,Computer Science,Algorithms,5,thehitman@gmail.com
5,Implement the Dinic's algorithm for finding maximum flow in a network and analyze its efficiency.,Computer Science,Algorithms,5,thehitman@gmail.com
5,Describe the process of constructing a suffix tree using Ukkonen's algorithm.,Computer Science,Algorithms,5,thehitman@gmail.com
5,Discuss the principles of randomized algorithms for solving graph problems.,Computer Science,Algorithms,5,thehitman@gmail.com
5,Implement a dynamic programming solution for the Traveling Salesman Problem (TSP).,Computer Science,Algorithms,5,thehitman@gmail.com
5,Explain the concept of parallel algorithms and their applications in computer systems.,Computer Science,Algorithms,5,thehitman@gmail.com
5,Discuss the working principles of the Strongly Polynomial Time Algorithm for Linear Programming.,Computer Science,Algorithms,5,thehitman@gmail.com
5,Implement the Longest Increasing Subsequence (LIS) problem using a binary search approach.,Computer Science,Algorithms,5,thehitman@gmail.com
5,Discuss the implementation of the Visitor design pattern in object-oriented programming.,Computer Science,Computer Programming,5,thehitman@gmail.com
5,Implement a function to perform matrix exponentiation using the binary exponentiation method.,Computer Science,Computer Programming,5,thehitman@gmail.com
5,Explain the concept of lambda expressions and functional interfaces in Java.,Computer Science,Computer Programming,5,thehitman@gmail.com
5,Discuss the design and implementation of a garbage collector in a programming language.,Computer Science,Computer Programming,5,thehitman@gmail.com
5,Implement a function to solve the N-Queens problem using backtracking with pruning.,Computer Science,Computer Programming,5,thehitman@gmail.com
5,Describe the principles of multi-threading and synchronization in concurrent programming.,Computer Science,Computer Programming,5,thehitman@gmail.com
5,Discuss the implementation of the Union-Find data structure using path compression and union by rank.,Computer Science,Computer Programming,5,thehitman@gmail.com
5,Implement a dynamic programming solution for the Edit Distance problem.,Computer Science,Computer Programming,5,thehitman@gmail.com
5,Explain the process of constructing a KD tree and its applications in efficient k-nearest neighbor search.,Computer Science,Computer Programming,5,thehitman@gmail.com
1,Explain the concept of multitasking in operating systems.,Computer Science,Operating Systems,2,thehitman@gmail.com
1,What is a process in the context of operating systems?,Computer Science,Operating Systems,1,thehitman@gmail.com
1,Discuss the purpose of virtual memory in modern operating systems.,Computer Science,Operating Systems,3,thehitman@gmail.com
1,Define deadlock in operating systems and how it can be avoided.,Computer Science,Operating Systems,4,thehitman@gmail.com
1,What is a semaphore and how is it used for process synchronization?,Computer Science,Operating Systems,2,thehitman@gmail.com
1,Explain the difference between a monolithic kernel and a microkernel in operating systems.,Computer Science,Operating Systems,3,thehitman@gmail.com
1,What are the main functions of an operating system?,Computer Science,Operating Systems,1,thehitman@gmail.com
1,Discuss the role of a file system in an operating system.,Computer Science,Operating Systems,2,thehitman@gmail.com
1,What is a device driver and why is it essential in operating systems?,Computer Science,Operating Systems,3,thehitman@gmail.com
1,Explain the purpose of the process scheduler in operating systems.,Computer Science,Operating Systems,2,thehitman@gmail.com
1,What are the differences between preemptive and non-preemptive scheduling in operating systems?,Computer Science,Operating Systems,4,thehitman@gmail.com
1,Discuss the advantages and disadvantages of using a GUI in an operating system.,Computer Science,Operating Systems,3,thehitman@gmail.com
1,Explain the concept of demand paging in virtual memory management.,Computer Science,Operating Systems,5,thehitman@gmail.com
1,What is a context switch and why is it necessary in multitasking operating systems?,Computer Science,Operating Systems,4,thehitman@gmail.com
1,Discuss the role of the bootstrap loader in the booting process of an operating system.,Computer Science,Operating Systems,2,thehitman@gmail.com
1,Explain the concept of file permissions in operating systems.,Computer Science,Operating Systems,2,thehitman@gmail.com
1,What is a page fault and how is it handled in virtual memory systems?,Computer Science,Operating Systems,4,thehitman@gmail.com
1,Discuss the purpose of a disk scheduler in operating systems.,Computer Science,Operating Systems,3,thehitman@gmail.com
1,What is the role of the I/O manager in an operating system?,Computer Science,Operating Systems,3,thehitman@gmail.com
1,Explain the difference between internal and external fragmentation in memory management.,Computer Science,Operating Systems,4,thehitman@gmail.com
2,Explain the concept of virtualization and its benefits in operating systems.,Computer Science,Operating Systems,3,thehitman@gmail.com
2,Discuss the working principles of the first-fit memory allocation algorithm.,Computer Science,Operating Systems,4,thehitman@gmail.com
2,What is a race condition and how can it be avoided in concurrent programming?,Computer Science,Operating Systems,4,thehitman@gmail.com
2,Explain the concept of process synchronization using semaphores in operating systems.,Computer Science,Operating Systems,3,thehitman@gmail.com
2,Discuss the role of the page table in virtual memory management.,Computer Science,Operating Systems,4,thehitman@gmail.com
2,What are system calls and why are they necessary in operating systems?,Computer Science,Operating Systems,2,thehitman@gmail.com
2,Explain the purpose of the disk arm scheduling algorithm in disk management.,Computer Science,Operating Systems,5,thehitman@gmail.com
2,Discuss the differences between static and dynamic linking in operating systems.,Computer Science,Operating Systems,3,thehitman@gmail.com
2,What is the purpose of a spooling mechanism in operating systems?,Computer Science,Operating Systems,4,thehitman@gmail.com
2,Explain the concept of thrashing in virtual memory systems and how it can be prevented.,Computer Science,Operating Systems,5,thehitman@gmail.com
2,Discuss the benefits and drawbacks of using a priority-based scheduling algorithm in operating systems.,Computer Science,Operating Systems,3,thehitman@gmail.com
2,What is the working principle of the LRU (Least Recently Used) page replacement algorithm?,Computer Science,Operating Systems,4,thehitman@gmail.com
2,Explain the concept of mutual exclusion in process synchronization.,Computer Science,Operating Systems,3,thehitman@gmail.com
2,Discuss the purpose of the system clock in operating systems.,Computer Science,Operating Systems,2,thehitman@gmail.com
2,What is the role of a cache manager in an operating system?,Computer Science,Operating Systems,3,thehitman@gmail.com
2,Explain the concept of deadlock detection and recovery in operating systems.,Computer Science,Operating Systems,5,thehitman@gmail.com
2,Discuss the differences between symmetric and asymmetric multiprocessing in operating systems.,Computer Science,Operating Systems,4,thehitman@gmail.com
2,What is the purpose of the buffer cache in operating systems?,Computer Science,Operating Systems,3,thehitman@gmail.com
2,Explain the concept of a process control block (PCB) in operating systems.,Computer Science,Operating Systems,2,thehitman@gmail.com
3,Describe the working principles of the Banker's algorithm for deadlock avoidance.,Computer Science,Operating Systems,4,thehitman@gmail.com
3,Discuss the advantages and disadvantages of using demand-paged virtual memory.,Computer Science,Operating Systems,3,thehitman@gmail.com
3,What is the purpose of a command-line interpreter (shell) in an operating system?,Computer Science,Operating Systems,2,thehitman@gmail.com
3,Explain the concept of a zombie process and how it is handled in operating systems.,Computer Science,Operating Systems,4,thehitman@gmail.com
3,Discuss the differences between contiguous and non-contiguous memory allocation techniques.,Computer Science,Operating Systems,3,thehitman@gmail.com
3,What is the role of a page fault handler in virtual memory management?,Computer Science,Operating Systems,5,thehitman@gmail.com
3,Explain the concept of a thread in the context of multithreading in operating systems.,Computer Science,Operating Systems,3,thehitman@gmail.com
3,Discuss the benefits and drawbacks of using the FIFO (First-In-First-Out) page replacement algorithm.,Computer Science,Operating Systems,4,thehitman@gmail.com
3,What is the purpose of a logical address and a physical address in memory management?,Computer Science,Operating Systems,2,thehitman@gmail.com
3,Explain the concept of an interrupt handler in operating systems.,Computer Science,Operating Systems,2,thehitman@gmail.com
3,Discuss the role of the dispatcher in process scheduling.,Computer Science,Operating Systems,2,thehitman@gmail.com
3,What is the purpose of a disk cache in operating systems?,Computer Science,Operating Systems,3,thehitman@gmail.com
3,Explain the differences between static and dynamic memory allocation in operating systems.,Computer Science,Operating Systems,3,thehitman@gmail.com
3,Discuss the advantages and disadvantages of using a round-robin scheduling algorithm.,Computer Science,Operating Systems,4,thehitman@gmail.com
3,What is the working principle of the Optimal page replacement algorithm?,Computer Science,Operating Systems,5,thehitman@gmail.com
3,Explain the concept of a critical section in concurrent programming.,Computer Science,Operating Systems,4,thehitman@gmail.com
3,Discuss the differences between primary memory and secondary memory in an operating system.,Computer Science,Operating Systems,3,thehitman@gmail.com
3,What is the purpose of a job queue in operating systems?,Computer Science,Operating Systems,2,thehitman@gmail.com
3,Explain the concept of a distributed file system and its benefits.,Computer Science,Operating Systems,4,thehitman@gmail.com
4,Describe the working principles of the buddy memory allocation technique.,Computer Science,Operating Systems,4,thehitman@gmail.com
4,Discuss the advantages and disadvantages of using a priority inversion in operating systems.,Computer Science,Operating Systems,3,thehitman@gmail.com
4,What is the purpose of a dirty bit in a page table entry?,Computer Science,Operating Systems,3,thehitman@gmail.com
4,Explain the concept of process migration in distributed operating systems.,Computer Science,Operating Systems,4,thehitman@gmail.com
4,Discuss the differences between static and dynamic relocation in operating systems.,Computer Science,Operating Systems,3,thehitman@gmail.com
4,What is the working principle of the Scan disk scheduling algorithm?,Computer Science,Operating Systems,5,thehitman@gmail.com
4,Explain the concept of kernel mode and user mode in operating systems.,Computer Science,Operating Systems,4,thehitman@gmail.com
