marks,question,subject,topic,weightage,email
4,Discuss the benefits and drawbacks of using the Shortest Job Next (SJN) scheduling algorithm.,Computer Science,Operating Systems,3,thehitman@gmail.com
4,What is the purpose of the process state diagram in operating systems?,Computer Science,Operating Systems,2,thehitman@gmail.com
4,Explain the concept of cache coherence in multiprocessor systems.,Computer Science,Operating Systems,4,thehitman@gmail.com
4,Discuss the role of the Swapping mechanism in virtual memory management.,Computer Science,Operating Systems,5,thehitman@gmail.com
4,What is the purpose of a logical file system in an operating system?,Computer Science,Operating Systems,4,thehitman@gmail.com
4,Explain the differences between a cooperative and preemptive multitasking model.,Computer Science,Operating Systems,3,thehitman@gmail.com
4,Discuss the working principles of the Second-Chance page replacement algorithm.,Computer Science,Operating Systems,4,thehitman@gmail.com
4,Explain the concept of process scheduling and discuss the various scheduling algorithms used in operating systems.,Computer Science,Operating Systems,3,thehitman@gmail.com
4,Discuss the purpose and working principles of a memory management unit (MMU) in virtual memory systems.,Computer Science,Operating Systems,4,thehitman@gmail.com
4,Explain the differences between internal fragmentation and external fragmentation in memory allocation.,Computer Science,Operating Systems,3,thehitman@gmail.com
4,Discuss the advantages and disadvantages of using a distributed file system in a network of computers.,Computer Science,Operating Systems,4,thehitman@gmail.com
4,Explain the concept of thread synchronization and the mechanisms used to achieve it in multithreading.,Computer Science,Operating Systems,4,thehitman@gmail.com
5,Discuss the challenges and techniques involved in managing shared resources in a multiprocessor system.,Computer Science,Operating Systems,4,thehitman@gmail.com
5,Explain the concept of process communication and synchronization using inter-process communication (IPC) mechanisms.,Computer Science,Operating Systems,4,thehitman@gmail.com
5,Discuss the working principles and benefits of using a demand-paging virtual memory system in modern operating systems.,Computer Science,Operating Systems,5,thehitman@gmail.com
5,Explain the concept of disk scheduling and compare the performance of different disk scheduling algorithms.,Computer Science,Operating Systems,4,thehitman@gmail.com
5,Discuss the differences between symmetric and asymmetric multiprocessing and their applications in operating systems.,Computer Science,Operating Systems,3,thehitman@gmail.com
5,Explain the role of a cache manager and the strategies used for cache management in an operating system.,Computer Science,Operating Systems,4,thehitman@gmail.com
5,Discuss the challenges and approaches in handling concurrency and avoiding race conditions in concurrent programming.,Computer Science,Operating Systems,4,thehitman@gmail.com
5,Explain the concept of deadlock and the techniques used for deadlock detection and prevention in operating systems.,Computer Science,Operating Systems,5,thehitman@gmail.com
5,Discuss the working principles of the buddy memory allocation technique and compare it with other memory allocation methods.,Computer Science,Operating Systems,4,thehitman@gmail.com
5,Explain the concept of process synchronization and mutual exclusion using semaphores and monitors in operating systems.,Computer Science,Operating Systems,4,thehitman@gmail.com
5,Discuss the advantages and disadvantages of using virtual memory and its impact on system performance and memory management.,Computer Science,Operating Systems,5,thehitman@gmail.com
5,Explain the concept of thread management and the advantages of using threads in the context of multithreading in operating systems.,Computer Science,Operating Systems,4,thehitman@gmail.com
5,Discuss the role of the kernel in an operating system and the different modes (kernel mode and user mode) of operation.,Computer Science,Operating Systems,4,thehitman@gmail.com
5,Explain the purpose and working of the page replacement algorithms including: FIFO LRU and Optimal.,Computer Science,Operating Systems,5,thehitman@gmail.com
5,Discuss the principles and advantages of using a priority-based scheduling algorithm in a multitasking operating system.,Computer Science,Operating Systems,4,thehitman@gmail.com
5,Explain the concept of deadlock avoidance and the Banker's algorithm for handling resource allocation in an operating system.,Computer Science,Operating Systems,5,thehitman@gmail.com
5,Discuss the role of the memory management unit (MMU) in virtual memory systems and the process of address translation.,Computer Science,Operating Systems,4,thehitman@gmail.com
5,Explain the working principles of the round-robin scheduling algorithm and its role in process scheduling.,Computer Science,Operating Systems,4,thehitman@gmail.com
5,Discuss the purpose and implementation of the spooling mechanism in an operating system for managing I/O tasks.,Computer Science,Operating Systems,4,thehitman@gmail.com
5,Explain the concept of thread safety and the techniques used to ensure thread safety in multithreaded programming.,Computer Science,Operating Systems,4,thehitman@gmail.com
1,What is a database?,Computer Science,Databases,2,thehitman@gmail.com
1,Define a primary key.,Computer Science,Databases,1,thehitman@gmail.com
1,What is normalization in databases?,Computer Science,Databases,3,thehitman@gmail.com
1,Explain the concept of a foreign key.,Computer Science,Databases,2,thehitman@gmail.com
1,What is a relational database?,Computer Science,Databases,1,thehitman@gmail.com
1,What is a table in a database?,Computer Science,Databases,1,thehitman@gmail.com
1,"Define the term ACID"""" in the context of databases.""""",Computer Science,Databases,4,thehitman@gmail.com
1,What is a database management system (DBMS)?,Computer Science,Databases,1,thehitman@gmail.com
1,What is the purpose of an index in a database?,Computer Science,Databases,2,thehitman@gmail.com
1,Explain the concept of data redundancy.,Computer Science,Databases,3,thehitman@gmail.com
1,What are database transactions?,Computer Science,Databases,1,thehitman@gmail.com
1,"Define the term data integrity.""""""""",Computer Science,Databases,2,thehitman@gmail.com
1,What is a schema in a database?,Computer Science,Databases,1,thehitman@gmail.com
1,Explain the difference between SQL and NoSQL databases.,Computer Science,Databases,3,thehitman@gmail.com
1,What is the role of a DBA (Database Administrator)?,Computer Science,Databases,2,thehitman@gmail.com
1,What is data modeling in databases?,Computer Science,Databases,1,thehitman@gmail.com
1,"Define the term data warehouse.""""""""",Computer Science,Databases,3,thehitman@gmail.com
1,What is a composite key?,Computer Science,Databases,2,thehitman@gmail.com
1,Explain the concept of data normalization.,Computer Science,Databases,3,thehitman@gmail.com
1,What is the purpose of a view in a database?,Computer Science,Databases,2,thehitman@gmail.com
2,Discuss the advantages and disadvantages of using a relational database.,Computer Science,Databases,3,thehitman@gmail.com
2,Explain the differences between a clustered and a non-clustered index.,Computer Science,Databases,4,thehitman@gmail.com
2,What is the role of a trigger in a database?,Computer Science,Databases,3,thehitman@gmail.com
2,Discuss the purpose and working of the SELECT statement in SQL.,Computer Science,Databases,3,thehitman@gmail.com
2,Explain the concept of data denormalization and its use in databases.,Computer Science,Databases,4,thehitman@gmail.com
2,What are the different types of database constraints and how are they used?,Computer Science,Databases,2,thehitman@gmail.com
2,Discuss the benefits and drawbacks of using a distributed database system.,Computer Science,Databases,4,thehitman@gmail.com
2,Explain the differences between logical and physical data independence.,Computer Science,Databases,3,thehitman@gmail.com
2,What is the purpose of a JOIN operation in SQL?,Computer Science,Databases,3,thehitman@gmail.com
2,Discuss the working principles of the COMMIT and ROLLBACK commands in database transactions.,Computer Science,Databases,3,thehitman@gmail.com
2,Explain the concept of referential integrity in database design.,Computer Science,Databases,4,thehitman@gmail.com
2,Discuss the advantages of using an ORM (Object-Relational Mapping) tool in database applications.,Computer Science,Databases,3,thehitman@gmail.com
2,What is the purpose of the GROUP BY clause in SQL?,Computer Science,Databases,2,thehitman@gmail.com
2,Explain the concept of data aggregation in databases.,Computer Science,Databases,3,thehitman@gmail.com
2,Discuss the differences between a one-to-many and a many-to-many relationship in database design.,Computer Science,Databases,4,thehitman@gmail.com
2,What is the role of a stored procedure in a database?,Computer Science,Databases,3,thehitman@gmail.com
2,Explain the purpose of the DDL (Data Definition Language) in database management.,Computer Science,Databases,2,thehitman@gmail.com
2,Discuss the benefits of using database normalization techniques.,Computer Science,Databases,3,thehitman@gmail.com
2,What is the purpose of the WHERE clause in SQL?,Computer Science,Databases,2,thehitman@gmail.com
2,Explain the concept of a candidate key in database design.,Computer Science,Databases,3,thehitman@gmail.com
3,Discuss the principles and benefits of using the Entity-Relationship (ER) model for database design.,Computer Science,Databases,4,thehitman@gmail.com
3,Explain the concept of a transaction log and its importance in database recovery.,Computer Science,Databases,4,thehitman@gmail.com
3,Discuss the differences between a primary key candidate key and superkey in database design.,Computer Science,Databases,4,thehitman@gmail.com
3,Explain the purpose and working of the UPDATE statement in SQL.,Computer Science,Databases,3,thehitman@gmail.com
3,Discuss the benefits and drawbacks of using denormalization techniques in databases.,Computer Science,Databases,4,thehitman@gmail.com
3,What are the various types of JOIN operations in SQL and how are they used?,Computer Science,Databases,3,thehitman@gmail.com
3,Explain the concept of data partitioning in distributed database systems.,Computer Science,Databases,4,thehitman@gmail.com
3,Discuss the working principles of the INSERT statement in SQL.,Computer Science,Databases,3,thehitman@gmail.com
3,What is the role of database indexes in query optimization?,Computer Science,Databases,4,thehitman@gmail.com
3,Explain the concept of data concurrency control in database transactions.,Computer Science,Databases,4,thehitman@gmail.com
3,Discuss the differences between a logical schema and a physical schema in database design.,Computer Science,Databases,3,thehitman@gmail.com
3,Explain the purpose and use of triggers in database applications.,Computer Science,Databases,3,thehitman@gmail.com
3,Discuss the benefits of using views in a database management system.,Computer Science,Databases,3,thehitman@gmail.com
3,What is the purpose of the HAVING clause in SQL?,Computer Science,Databases,2,thehitman@gmail.com
3,Explain the concept of data warehousing and its benefits for business intelligence.,Computer Science,Databases,3,thehitman@gmail.com
3,Discuss the differences between a surrogate key and a natural key in database design.,Computer Science,Databases,3,thehitman@gmail.com
4,Discuss the principles and challenges of database replication for high availability.,Computer Science,Databases,4,thehitman@gmail.com
4,Explain the concept of data sharding and its use in distributed databases.,Computer Science,Databases,4,thehitman@gmail.com
4,Discuss the benefits and drawbacks of using the NoSQL database model.,Computer Science,Databases,3,thehitman@gmail.com
4,Explain the purpose and use of stored procedures and functions in a database.,Computer Science,Databases,4,thehitman@gmail.com
4,Discuss the differences between a clustered and a non-clustered index in database management.,Computer Science,Databases,3,thehitman@gmail.com
4,Explain the concept of data encryption and its importance in database security.,Computer Science,Databases,4,thehitman@gmail.com
4,Discuss the benefits and challenges of using database triggers for data validation.,Computer Science,Databases,3,thehitman@gmail.com
4,Explain the purpose and working of the UNION and UNION ALL operators in SQL.,Computer Science,Databases,3,thehitman@gmail.com
4,Discuss the differences between vertical and horizontal partitioning in database design.,Computer Science,Databases,4,thehitman@gmail.com
4,Explain the concept of data archiving and its importance in database maintenance.,Computer Science,Databases,3,thehitman@gmail.com
4,Discuss the benefits and drawbacks of using the EAV (Entity-Attribute-Value) model in databases.,Computer Science,Databases,4,thehitman@gmail.com
4,Explain the purpose and use of the CASE statement in SQL queries.,Computer Science,Databases,3,thehitman@gmail.com
4,Discuss the differences between an OLTP (Online Transaction Processing) and an OLAP (Online Analytical Processing) database.,Computer Science,Databases,4,thehitman@gmail.com
4,Explain the concept of a materialized view and its use for query optimization.,Computer Science,Databases,3,thehitman@gmail.com
4,Discuss the benefits and challenges of using a distributed database architecture.,Computer Science,Databases,4,thehitman@gmail.com
4,Explain the purpose and working of the DELETE statement in SQL.,Computer Science,Databases,3,thehitman@gmail.com
4,Discuss the differences between a 1NF (First Normal Form) and a 2NF (Second Normal Form) database schema.,Computer Science,Databases,3,thehitman@gmail.com
4,Explain the concept of a database transaction and the properties of ACID.,Computer Science,Databases,4,thehitman@gmail.com
4,Discuss the benefits and drawbacks of using database views for data security and access control.,Computer Science,Databases,3,thehitman@gmail.com
4,Explain the concept of data replication and the different replication method such as master-slave and multi-master replication.,Computer Science,Databases,4,thehitman@gmail.com
5,Discuss the principles and benefits of using a relational database management system (RDBMS).,Computer Science,Databases,5,thehitman@gmail.com
5,Explain the concept of database normalization and its role in eliminating data redundancy and improving data integrity.,Computer Science,Databases,4,thehitman@gmail.com
5,Discuss the challenges and techniques involved in ensuring data consistency and integrity in a distributed database system.,Computer Science,Databases,4,thehitman@gmail.com
5,Explain the purpose and working of the JOIN operation in SQL including INNER JOIN LEFT JOIN RIGHT JOIN and FULL JOIN.,Computer Science,Databases,5,thehitman@gmail.com
5,Discuss the differences between a row-based and a column-based database storage model and their respective advantages.,Computer Science,Databases,4,thehitman@gmail.com
5,Explain the concept of a database transaction and the importance of transaction management for data consistency and recovery.,Computer Science,Databases,5,thehitman@gmail.com
5,Discuss the principles and benefits of using database indexing for query performance optimization.,Computer Science,Databases,5,thehitman@gmail.com
5,Explain the purpose and use of database constraints including PRIMARY KEY FOREIGN KEY UNIQUE and CHECK constraints.,Computer Science,Databases,5,thehitman@gmail.com
5,Discuss the challenges and techniques involved in database replication for achieving high availability and fault tolerance.,Computer Science,Databases,4,thehitman@gmail.com
5,Explain the concept of data warehousing and its use for business intelligence and data analytics.,Computer Science,Databases,5,thehitman@gmail.com
5,Discuss the principles and challenges of database sharding for scalability and performance in distributed database systems.,Computer Science,Databases,4,thehitman@gmail.com
5,Explain the purpose and use of stored procedures and functions in a database management system (DBMS).,Computer Science,Databases,5,thehitman@gmail.com
5,Discuss the differences between a star schema and a snowflake schema in data warehousing design.,Computer Science,Databases,4,thehitman@gmail.com
5,Explain the concept of data partitioning and its use for improving data distribution and query performance in distributed databases.,Computer Science,Databases,5,thehitman@gmail.com
5,Discuss the benefits and drawbacks of using the CAP theorem for distributed database design.,Computer Science,Databases,4,thehitman@gmail.com
5,Explain the purpose and working of the SQL JOIN operation including examples of multi-table joins and self-joins.,Computer Science,Databases,5,thehitman@gmail.com
5,Discuss the differences between database backups and database snapshots and their respective use cases for data recovery.,Computer Science,Databases,4,thehitman@gmail.com
5,Explain the concept of database replication and the different replication methods such as master-slave and multi-master replication.,Computer Science,Databases,5,thehitman@gmail.com
5,Discuss the principles and challenges of database sharding for achieving horizontal scalability in distributed databases.,Computer Science,Databases,4,thehitman@gmail.com
5,Explain the purpose and use of data caching in a database management system (DBMS) for improving query performance.,Computer Science,Databases,5,thehitman@gmail.com
1,What is the CPU (Central Processing Unit)?,Computer Science,Computer Architecture,2,thehitman@gmail.com
1,Define a cache memory.,Computer Science,Computer Architecture,1,thehitman@gmail.com
1,What is the role of the ALU (Arithmetic Logic Unit)?,Computer Science,Computer Architecture,2,thehitman@gmail.com
1,Explain the concept of a register in a CPU.,Computer Science,Computer Architecture,1,thehitman@gmail.com
1,What is the purpose of the control unit in a processor?,Computer Science,Computer Architecture,2,thehitman@gmail.com
1,"Define the term instruction set architecture.""""""""",Computer Science,Computer Architecture,3,thehitman@gmail.com
1,What is the function of the program counter (PC)?,Computer Science,Computer Architecture,2,thehitman@gmail.com
1,Explain the concept of pipelining in computer architecture.,Computer Science,Computer Architecture,3,thehitman@gmail.com
1,What is the role of a clock signal in a CPU?,Computer Science,Computer Architecture,1,thehitman@gmail.com
1,"Define the term Von Neumann architecture.""""""""",Computer Science,Computer Architecture,2,thehitman@gmail.com
1,What is the purpose of the MAR (Memory Address Register)?,Computer Science,Computer Architecture,1,thehitman@gmail.com
1,Explain the concept of parallel processing.,Computer Science,Computer Architecture,3,thehitman@gmail.com
1,What is the function of the data bus in a computer system?,Computer Science,Computer Architecture,1,thehitman@gmail.com
1,"Define the term Harvard architecture.""""""""",Computer Science,Computer Architecture,2,thehitman@gmail.com
1,What is the purpose of the MDR (Memory Data Register)?,Computer Science,Computer Architecture,1,thehitman@gmail.com
1,Explain the concept of RISC (Reduced Instruction Set Computer).,Computer Science,Computer Architecture,3,thehitman@gmail.com
1,What is the role of the microprogram in a processor?,Computer Science,Computer Architecture,2,thehitman@gmail.com
1,"Define the term CISC (Complex Instruction Set Computer).""""""""",Computer Science,Computer Architecture,3,thehitman@gmail.com
1,What is the purpose of the cache controller in a CPU?,Computer Science,Computer Architecture,2,thehitman@gmail.com
1,Explain the concept of endianness in computer architecture.,Computer Science,Computer Architecture,3,thehitman@gmail.com
2,Discuss the differences between a single-core and a multi-core processor.,Computer Science,Computer Architecture,4,thehitman@gmail.com
2,Explain the purpose and working of a branch predictor in computer architecture.,Computer Science,Computer Architecture,4,thehitman@gmail.com
2,What is the role of the FPU (Floating-Point Unit) in a CPU?,Computer Science,Computer Architecture,3,thehitman@gmail.com
2,Discuss the principles and benefits of using pipelined architecture in CPUs.,Computer Science,Computer Architecture,4,thehitman@gmail.com
2,Explain the concept of the memory hierarchy in computer systems.,Computer Science,Computer Architecture,3,thehitman@gmail.com
2,Discuss the differences between a synchronous and an asynchronous processor.,Computer Science,Computer Architecture,4,thehitman@gmail.com
2,Explain the purpose and working of the Memory Management Unit (MMU).,Computer Science,Computer Architecture,3,thehitman@gmail.com
2,Explain the concept of cache coherency in multiprocessor systems.,Computer Science,Computer Architecture,3,thehitman@gmail.com
2,Discuss the differences between a fixed-point and a floating-point representation of numbers.,Computer Science,Computer Architecture,4,thehitman@gmail.com
2,Explain the purpose and use of branch instructions in CPU architectures.,Computer Science,Computer Architecture,3,thehitman@gmail.com
2,Discuss the principles and benefits of using a superscalar processor.,Computer Science,Computer Architecture,4,thehitman@gmail.com
2,Explain the concept of cache mapping techniques such as direct-mapped and set-associative and fully associative.,Computer Science,Computer Architecture,3,thehitman@gmail.com
2,Discuss the differences between little-endian and big-endian byte ordering.,Computer Science,Computer Architecture,4,thehitman@gmail.com
2,Explain the purpose and working of the virtual memory system in computer architecture.,Computer Science,Computer Architecture,3,thehitman@gmail.com
2,Discuss the benefits and challenges of using a distributed database architecture.,Computer Science,Computer Architecture,4,thehitman@gmail.com
2,Explain the differences between a synchronous and an asynchronous bus in computer architecture.,Computer Science,Computer Architecture,3,thehitman@gmail.com
2,Discuss the principles and benefits of using a cache memory in computer systems.,Computer Science,Computer Architecture,4,thehitman@gmail.com
3,Explain the working principles of the Fetch-Decode-Execute cycle in a CPU.,Computer Science,Computer Architecture,5,thehitman@gmail.com
3,Discuss the differences between a Harvard architecture and a Von Neumann architecture.,Computer Science,Computer Architecture,4,thehitman@gmail.com
3,Explain the concept of the memory-mapped I/O (Input/Output) in computer systems.,Computer Science,Computer Architecture,4,thehitman@gmail.com
3,Discuss the benefits and drawbacks of using a complex instruction set in computer architecture.,Computer Science,Computer Architecture,5,thehitman@gmail.com
3,Explain the purpose and working of the Translation Lookaside Buffer (TLB) in virtual memory systems.,Computer Science,Computer Architecture,4,thehitman@gmail.com
3,Discuss the differences between a CISC (Complex Instruction Set Computer) and a RISC (Reduced Instruction Set Computer) processor.,Computer Science,Computer Architecture,5,thehitman@gmail.com
3,Explain the concept of cache write policies including write-through and write-back.,Computer Science,Computer Architecture,4,thehitman@gmail.com
3,Discuss the benefits and challenges of using a speculative execution in a CPU.,Computer Science,Computer Architecture,5,thehitman@gmail.com
3,Explain the purpose and working of the Interrupt Request (IRQ) system in computer architecture.,Computer Science,Computer Architecture,4,thehitman@gmail.com
3,Discuss the differences between a single-level and a multi-level cache hierarchy.,Computer Science,Computer Architecture,5,thehitman@gmail.com
3,Explain the concept of a pipelined floating-point unit in a CPU.,Computer Science,Computer Architecture,4,thehitman@gmail.com
3,Discuss the benefits and drawbacks of using a SIMD (Single Instruction Multiple Data) instruction set architecture.,Computer Science,Computer Architecture,5,thehitman@gmail.com
3,Explain the purpose and working of the Branch Target Buffer (BTB) in a CPU.,Computer Science,Computer Architecture,4,thehitman@gmail.com
3,Discuss the differences between a synchronous and an asynchronous memory.,Computer Science,Computer Architecture,5,thehitman@gmail.com
3,Explain the concept of cache replacement policies such as LRU (Least Recently Used) and FIFO (First-In-First-Out).,Computer Science,Computer Architecture,4,thehitman@gmail.com
3,Discuss the principles and benefits of using a multi-threaded processor.,Computer Science,Computer Architecture,5,thehitman@gmail.com
3,Explain the purpose and use of the Translation Lookaside Buffer (TLB) in virtual memory systems.,Computer Science,Computer Architecture,4,thehitman@gmail.com
3,Discuss the differences between a multi-core and a many-core processor.,Computer Science,Computer Architecture,5,thehitman@gmail.com
3,Explain the concept of cache coherence protocols such as MESI (Modified Exclusive Shared Invalid).,Computer Science,Computer Architecture,4,thehitman@gmail.com
3,Discuss the principles and benefits of using a SIMD (Single Instruction Multiple Data) architecture for multimedia processing.,Computer Science,Computer Architecture,5,thehitman@gmail.com
4,Discuss the working principles of the memory hierarchy and its impact on computer system performance.,Computer Science,Computer Architecture,4,thehitman@gmail.com
4,Explain the differences between a pipelined and a non-pipelined processor design.,Computer Science,Computer Architecture,4,thehitman@gmail.com
4,Discuss the benefits and challenges of using a multi-core processor architecture for parallel processing.,Computer Science,Computer Architecture,4,thehitman@gmail.com
